{
  "section": "般若心経秘鍵",
  "source": "弘法大師空海著作",
  "text": "【般若心経秘鍵（はんにゃしんぎょうひけん）概要】弘法大師空海著。般若心経を顕教的解釈と密教的解釈の両面から解説した注釈書。「秘鍵」とは秘密の鍵の意で、般若心経の奥深い密教的意味を解き明かす鍵を示す書。空海は般若心経を単なる般若（智慧）の経典としてではなく、即身成仏（そくしんじょうぶつ）を説く密教経典として読み解いた。顕教・密教双方の視点から般若心経を解読した先駆的著作。\n\n【序文・核心の宣言】\n「仏法遥かに非ず、心中にして即ち近し。真如外に非ず、身を棄てて何んか求めん。迷悟我に在り。則ち発心すれば即ち到る。」（般若心経秘鍵 序文）\n仏の教えは遠いところにあるのではなく、自分の心の中にこそある。真如（しんにょ、宇宙の真実）は外部にあるのではなく、この身を捨ててどこに求めようか——迷いも悟りも自分自身の中にある。発心（ほっしん）すれば、即座に到達できる。真言密教の「即身成仏」を簡潔に宣言した言葉。\n\n「一字に千理を含み、即身に法如を証す。」（般若心経秘鍵）\n一つの文字（特に阿字・梵字）の中に千の真理が含まれており、この身このままで宇宙の真如（法如）を証得する。密教の文字観（声字実相義と連動）と即身成仏を結びつけた言葉。\n\n【三界・生死観】\n「三界は客舎の如し、一心は是れ本居なり。」（般若心経秘鍵）\n欲界・色界・無色界の三界（さんかい）はまるで旅の宿屋のようなもので、一心（いっしん、自分の本来の心）こそが本当の住まいである。現世は仮の宿であり、一心の故郷へ帰ること——これが仏教の死生観の核心。葬儀において「故人は三界の仮の宿を去り、本来の故郷・一心の本居へ帰られた」と語れる根拠。\n\n「行行として円寂に至り、去去として原初に入る。」（般若心経秘鍵）\n行き行いていって円寂（えんじゃく、完全な涅槃）へ到り、去り去っていって原初（もとの始まり）へ入る。円寂とは完全な静けさ・完成した悟りの境地（涅槃の別名）。「去って帰る」というパラドックスの中に死と悟りの意味を重ねた詩的表現。\n\n「風葉に因縁を知る。露花に種子を除く。」（般若心経秘鍵）\n風に散る葉に縁起（えんぎ、因縁の道理）を見て取り、露に濡れた花に（執着の）種子を取り除く。自然の風景の中に法（ダルマ）の真理を読み取る密教的自然観。無常の美しさと教えの豊かさを詩的に表現。\n\n【般若心経の密教的解釈】\n空海は般若心経を五分（ごぶ）に分けて解釈する。\n①序分（じょぶん）：「観自在菩薩行深般若波羅蜜多時」——深い般若の修行の場面設定。\n②正宗分（しょうしゅうぶん）：「照見五蘊皆空」から「無智亦無得」——空の理を明かす核心部分。\n③秘鍵の核心：「以無所得故」——執着するものが何もないゆえに、菩薩は智慧の完成に住する。\n④真言分（しんごんぶん）：「羯諦羯諦（ぎゃていぎゃてい）…」——般若の真言（マントラ）。密教的には、この真言部分こそが般若心経の精髄。\n⑤流通分（るずうぶん）：経典の普及・流通の願い。\n\n「照見五蘊皆空（しょうけんごうんかいくう）」の密教的解釈：\n五蘊（色・受・想・行・識）がすべて空であると照見すること——顕教では無我・空の理として解釈されるが、密教では空が即ち大日如来の自内証（じないしょう）であり、空の体験が即身成仏につながると解釈する。\n\n「色即是空（しきそくぜくう）、空即是色（くうそくぜしき）」の密教的解釈：\n色（物質的現象）は即ち空であり、空は即ち色である。顕教では二元論の超克として解釈されるが、密教では「色」が六大（地水火風空識）の現れであり、「空」が大日如来の法身であり、両者は即（そく）の関係にあると解釈する。\n\n【羯諦真言の解釈】\n「羯諦羯諦、波羅羯諦、波羅僧羯諦、菩提薩婆訶」\n（ぎゃていぎゃてい、はらぎゃてい、はらそうぎゃてい、ぼじそわか）\n空海は般若心経が真言（陀羅尼）を持つ密教経典であることを重視する。「羯諦」は「行きたまえ」の意（梵語：gate）。「波羅羯諦」は「彼岸へ行きたまえ」（paragate）。「波羅僧羯諦」は「共に彼岸へ行きたまえ」（parasamgate）。「菩提薩婆訶」は「悟りよ、成就せよ」（bodhisvāhā）。\n密教的には、この真言を唱えることが行者の三密と仏の三密を合一させる実践となる。\n\n【発心・回向の教え】\n「発心すれば即ち到る」——発心（菩提心を起こすこと）こそが悟りへの直接の入り口。長劫の修行を経ずとも、真実の発心の瞬間に悟りは開かれる。\n\n「廻向（えこう）の功徳は限りなく」——自己の修行・善行の功徳を一切衆生に回し向けること。これにより功徳は限りなく広がり、すべての衆生に及ぶ。\n\n【故人・法話への応用（般若心経秘鍵の視点より）】\n「仏法遥かに非ず、心中にして即ち近し」：仏は遠いところにいるのではなく、故人の心の中にいつも共にいた。故人が手を合わせるとき、その心の中に仏がいた。\n\n「三界は客舎の如し、一心は是れ本居なり」：故人は三界という仮の宿を去り、一心の本居、本来の故郷へ帰られた。これは「故郷へ帰る旅立ち」として死を語る根拠。\n\n「行行として円寂に至り、去去として原初に入る」：故人の歩みは円寂（完全な安らぎ）へ向かう歩みであった。その旅立ちは去ることであり、同時に原初の安らぎへ入ることでもある。\n\n「発心すれば即ち到る」：故人がこの人生で心を向けた先に、仏の世界があった。信仰の心を持ち続けたことが、そのまま仏への道となっていた。\n\n「色即是空」：故人の命は色（形あるもの）として現れ、そして空（形を超えたもの）へと戻った。しかし空即是色——その空の中に故人は永遠に生き続ける。\n\n【関連用語】\n般若（はんにゃ）：智慧。特に空の真理を見抜く最高の智慧。梵語：prajñā（プラジュニャー）。\n空（くう）：固定した実体がないこと。縁起の真理の別名。\n五蘊（ごうん）：色・受・想・行・識。人間を構成する五つの要素。\n円寂（えんじゃく）：完全な涅槃。すべての煩悩が滅した完全な安らぎの境地。\n発心（ほっしん）：菩提心を起こすこと。悟りを求め衆生を救おうとする心の発動。\n廻向（えこう）：自己の功徳を衆生に回し向けること。\n真如（しんにょ）：宇宙の真実・本性。変わらぬ究極の実在。梵語：tathatā（タタター）。",
  "kakikudashi": "般若心経秘鍵　書き下し文\n般若心経秘鍵\n般若心経秘鍵 序幷せたり 遍照金剛撰\n一\n文殊の利剣は諸戯を絶つ 覚母の梵文は調御の師なり｢ぢくまん｣ の真言を種子とす 諸教を含蔵せる陀羅尼なり 無辺の生死何んが能く断つ 唯禅那正思惟のみ有ってす 尊者の三摩は仁譲らず 我今讃述す哀悲を垂れたまえ\n二\n夫れ仏法遥かに非ず、心中にして即ち近し。真如外に非ず、身を棄てて何くんか求めん。迷悟我に在れば、発心すれば即ち到る。明暗他に非ざれば、信修すれば忽ちに証す。哀れなる哉、哀れなる哉、長眠の子。苦しい哉、痛ましい哉、狂酔の人。痛狂は酔わざるを笑い、酷睡は覚者を嘲ける。曾つて医王の薬を訪らわずんば、何れの時にか大日の光を見ん。\n三\n翳障の軽重、覚悟の遅速のごときに至っては、機根不同にして、性欲即ち異なり、遂んじて二教轍を殊んじて、手を金蓮の場に分かち、五乗を並べて、蹄を幻影の埒に踠つ。其の解毒に随って、薬を得ること即ち別なり。慈父導子の方、大綱此に在り。\n四\n大般若波羅蜜多心経といっぱ、即ち是れ大般若菩薩の大心真言三摩地法門なり。文は一紙に欠けて、行は則ち十四なり。\n五\n余、童を教うるの次でに、聊か綱要を撮って、彼の五分を釈す。釈家多しと雖も、未だ此の幽を釣らず。翻訳の同異、顕密の差別、並びに後に釈するが如し。 或るひと問って云わく、般若は第二未了の教なり、何ぞ能く三顕の経を吞まん。 如来の説法は、一字に五乗の義を含み、一念に三蔵の法を説く。何に況んや、一部一品に何ぞ匱しく、何ぞ無からん。 亀卦爻蓍、万象を含んで尽くること無く、帝網声論、諸義を吞んで窮まらず。 難者の曰わく、若し然らば、前来の法匠何ぞ斯の言を吐かざる。答う、聖人の薬を投ずること、機の深浅に随い、賢者の説黙は、時を待ち人を待つ。吾未だ知らず、蓋し言うべきを言わざるか、言うまじければ言わざるか、言うまじきを之れを言えらん失、智人断わりたまえまくのみ。\n六\n仏説摩訶般若波羅蜜多心経といっぱ、此の題額に就いて、二つの別有り。梵漢別なるが故に。今仏説摩訶般若波羅蜜多心経と謂っぱ、胡漢雑え挙げたり。説心経の三字は漢名なり、余の九字は胡号なり。 若し具なる梵名ならば、｢ぼだはしゃまかはらじゃはらみたかりだそたらん｣と曰うべし。初めの二字は円満覚者の名、次の二字は密蔵を開悟し、甘露を施すの称なり。次の二字は、大多勝に就いて義を立つ。次の二字は、定慧に約して名を樹つ。次の三つは、所作已弁に就いて号とす。次の二つは、処中に拠って義を表わす。次の二つは、貫線摂持等を以って字を顕わす。 若し総の義を以って説かば、皆人法喩を具す。斯れ則ち大般若波羅蜜多菩薩の名なり、即ち是れ人なり。此の菩薩に、法曼荼羅真言三摩地門を具す。一一の字は、即ち法なり。 此の一一の名は、皆世間の浅名を以って、法性の深号を表わす。即ち是れ喩なり。此の三摩地門は、仏鷲峯山に在して、鶖子等の為に、之れを説いたまえり。\n七\n此の経に、数たの翻訳あり。第一に羅什三蔵の訳、今の所説の本是れなり。次に唐の遍覚三蔵の翻には、題に仏説摩訶の四字無し。五蘊の下に等の字を加え、遠離の下に一切の字を除く。陀羅尼の後に、功能無し。 次に大周の義浄三蔵の本には、題に摩訶の字を省き、真言の後に、功能を加えたり。又法月及び般若両三蔵の翻には、並びに序分流通有り。 又陀羅尼集経の第三の巻に、此の真言法を説けり。経の題、羅什と同じ。\n八\n般若心と言っぱ、此の菩薩に身心等の陀羅尼有り。是の経の真言は、即ち大心咒なり。此の心真言に依って、般若心の名を得。 或るが云わく、大般若経の心要を略出するが故に、心と名づく。是れ別会の説にあらずと。謂わゆる龍に蛇の鱗有るが如し。\n九\n此の経に、総じて五分有り。第一に人法総通分、観自在というより、度一切苦厄に至るまで、是れなり。第二に分別諸乗分、色不異空というより、無所得故に至るまで、是れなり。第三に行人得益分、菩提薩埵というより、三藐三菩提に至るまで、是れなり。第四に総帰持明分、故知般若というより、真実不虚に至るまで、是れなり。第五に秘蔵真言分、｢ぎゃていぎゃてい｣というより、｢ぼうじそわか｣に至るまで、是れなり。 第一の人法総通分に、五つ有り。因行証入時、是れなり。 観自在と言っぱ、能行の人、即ち此の人は、本覚の菩提を因とす。 深般若は能所観の法、即ち是れ行なり。 照空は則ち能証の智、度苦は則ち所得の果、果は則ち入なり。 彼の教に依る、人の智無量なり。智の差別に依って、時亦多し。三生三劫六十百妄執の差別、是れを時と名づく。 頌に曰わく、 観人智慧を修して 深く五衆の空を照らす 歴劫修念の者 煩を離れて一心に通ず 第二の分別諸乗分に、亦五つあり。建絶相二一、是れなり。 初めに建といっぱ、謂わゆる建立如来の三摩地門、是れなり。色不異空というより、亦復如是に至るまで、是れなり。建立如来といっぱ、即ち普賢菩薩の秘号なり。普賢の円因は、円融の三法を以って宗とす。かるが故に、以って之れに名づく。又是れ、一切如来菩提心行願の身なり。 頌に曰わく、 色空本より不二なり 事理元より来かた同なり 無礙に三種を融す 金水の喩え其の宗なり 二つに絶といっぱ、謂わゆる無戯論如来の三摩地門、是れなり。是諸法空相というより、不増不減に至るまで、是れなり。無戯論如来と言っぱ、即ち文殊菩薩の密号なり。文殊の利剣は能く八不を揮って、彼の妄執の心を絶つ、是の故に以って名づく。 頌に曰わく、 八不に諸戯を絶つ 文殊は是れ彼の人なり 独空畢竟の理 義用最も幽真なり 三つに相といっぱ、謂わゆる摩訶栴多羅冒地薩怛嚩の三摩地門、是れなり。是故空中無色というより、無意識界に至るまで、是れなり。大慈三昧は、与楽を以って宗とし、因果を示すを誡とす。相性別論し、唯識境を遮す。心、只此に在り。 頌に曰わく、 二我何れの時にか断つ 三祇に法身を証す 阿陀は是れ識性なり 幻影は即ち名賓なり 四つに二といっぱ、唯蘊無我抜業因種、是れなり。是れ即ち、二乗の三摩地門なり。無無明というより、無老死尽に至るまで、即ち是れ因縁仏の三昧なり。 頌に曰わく、 風葉に因縁を知る 輪廻幾ばくの年にか覚る 露花に種子を除く 羊鹿号相連なれり 無苦集滅道、此れ是の一句五字は、即ち依声得道の三昧なり。 頌に曰わく、 白骨に我何くんか在る 青瘀に人本より無し 我が師は是れ四念なり 羅漢亦何ぞ虞えん 五つに一といっぱ、阿哩也嚩路枳帝冒地薩怛嚩の三摩地門なり。無智というより、無所得故に至るまで、是れなり。此の得自性清浄如来は、一道清浄妙蓮不染を以って衆生に開示して、其の苦厄を抜く。智は能達を挙げ、得は所証に名づく。既に理智を泯ずれば、強ちに一の名を以ってす。法華涅槃等の摂末帰本の教、唯此の十字に含めり。諸乗の差別、智者之れを察せよ。 頌に曰わく、蓮を観じて自浄を知り 菓を見て心徳を覚る 一道に能所を泯ずれば 三車即ち帰黙す 第三の行人得益分に二つ有り、人法是れなり。初めの人に七つ有り、前の六つ、後の一つなり。乗の差別に随って、薩埵に異有るが故に、又薩埵に四つ有り、愚識金智是れなり。 次に又、法に四つあり、謂わく因行証入なり。般若は即ち能因能行、無㝵離障は即ち入涅槃、能証の覚智は即ち証果なり。文の如く思知せよ。 頌に曰わく、 行人の数は是れ七つ 重二彼の法なり 円寂と菩提と 正依何事か乏しからん 第四の総帰持明分に、又三つあり。名体用なり。四種の咒明は名を挙げ、真実不虚は体を指し、能除諸苦は用を顕わす。名を挙ぐる中に、初めの是大神咒は声聞の真言、二は縁覚の真言、三は大乗の真言、四は秘蔵の真言なり。若し通の義を以っていわば、一一の真言に皆四名を具す。略して一隅を示す。円智の人、三即帰一せよ。 頌に曰わく、 総持に文義忍咒有り 悉く持明なり 声字と人法と 実相とに此の名を具す 第五の秘蔵真言分に、五つ有り。初めの｢ぎゃてい｣は声聞の行果を顕わし、二の｢ぎゃてい｣は縁覚の行果を挙げ、三の｢はらぎゃてい｣は諸大乗最勝の行果を指し、四の｢はらそうぎゃてい｣は真言曼荼羅具足輪円の行果を明かし、五の｢ぼうじそわか｣は上の諸乗究竟菩提証入の義を説く。句義、是くの如し。若し字相義等に約して、之れを釈せば、無量の人法等の義有り。劫を歴ても、尽くし難し。若し要聞の者は、法に依って更に問え。 頒に曰わく、 真言は不思議なり 観誦すれば無明を除く 一字に千理を含み 即身に法如を証す 行行として円寂に至り 去去として原初に入る 三界は客舎の如し 一心は是れ本居なり\n十\n問う、陀羅尼は是れ如来の秘密語なり。このゆえに古の三蔵、諸の疏家、皆口を閉じ、筆を絶つ。今此の釈を作る、深く聖旨に背けり。如来の説法に二種有り、一つには顕、二つには秘。顕機の為には多名句を説き、秘根の為には総持の字を説く。是の故に、如来自ら字字等の種種の義を説いたまえり。是れ即ち秘機の為に、此の説を作す。龍猛無畏広智等も、亦、其の義を説いたもう。能不の間、教機に在り、まくのみ。之れを説き、之れを黙する、並びに仏意に契えり。 問う、顕密二教其の旨天かに懸かなり。今此の顕経の中に、秘義を説く、不可なり。医王の目には、途に触れて皆薬なり。解宝の人は、礦石を宝と見る。知ると知らざると、誰か罪過ぞ。又此の尊の真言儀軌観法は、仏金剛頂の中に説いたまえり。此れ秘が中の極秘なり。応化の釈迦、給孤園に在して、菩薩天人の為に、画像壇法真言手印等を説いたもう。亦是れ秘密なり。陀羅尼集経の第三の巻、是なり。顕密は人に在り、声字は即ち非なり。然れども猶顕が中の秘、秘が中の極秘なり、浅深重重まくのみ。\n十一\n我れ秘密真言の義に依って 略して心経五分の文を讃す 一字一文法界に遍じ 無終無始にして我が心分なり 翳眼の衆生は盲いて見ず曼儒般若は能く紛を解く 斯の甘露を灑いで迷者を霑おす 同じく無明を断じて魔軍を破せん\n般若心経秘鍵\n時に弘仁九年の春、天下に大疫あり。ここに帝皇みずから黄金を筆端に染め、紺紙を爪掌に握りて、般若心経一巻を書写したまう。予（よ）範として講読の撰、経旨の宗を綴る。いまだ結願の詞を吐かざるに、蘇生の族（やから）途（みち）に満てり。夜変じて日光赫赫たり。これ愚身の戒徳に非ず。金輪の御信力の所為なり。ただし神舎に詣る輩（ともがら）、この秘鍵を奉誦せよ。昔、予、鷲峯説法の莚（むしろ）に陪し、親しくこの深文を聞きき。豈にその義に達せざらんや、まくのみ。\n入唐沙門空海上表す",